{
  "id": "n-maplehub-stat-equivalent-calculator",
  "name": "MapleHub Stat Equivalent Comparison",
  "website": "MapleHub",
  "page": "Stat Equivalent Comparison",
  "url": "https://maplehub.io/stat",
  "series": "n",
  "regions": ["multi-region"],
  "languages": ["en", "id", "ja", "ko", "other", "th", "zh-hans", "zh-hant"],
  "category": "calculator",
  "subcategory": "stat-equivalence",
  "description": "Calculates stat equivalents and compares their relative effectiveness for a MapleStory N build.",
  "official": false,
  "opensource": false,
  "github_url": null,
  "api_url": null,
  "mobile_support": "responsive",
  "login_required": false,
  "status": "active",
  "last_checked": "2026-07-25",
  "tags": ["build", "comparison", "maplehub", "stats"],
  "source_urls": ["https://maplehub.io/stat"],
  "notes": null
}
