{
  "id": "classic-mapleclassic-route-planner",
  "name": "MapleClassic Wiki Route Planner",
  "website": "MapleClassic Wiki",
  "page": "MapleStory Classic World Route Planner",
  "url": "https://mapleclassic.wiki/wiki/Special:MyLanguage/MapleStory_Classic_World_Route_Planner",
  "series": "classic",
  "regions": ["global"],
  "languages": ["en", "ko"],
  "category": "planner",
  "subcategory": "map-route",
  "description": "Finds the shortest walking route between two Classic World maps and shows each portal crossing.",
  "official": false,
  "opensource": false,
  "github_url": null,
  "api_url": null,
  "mobile_support": "responsive",
  "login_required": false,
  "status": "active",
  "last_checked": "2026-07-25",
  "tags": ["maps", "navigation", "route", "wiki"],
  "source_urls": ["https://mapleclassic.wiki/wiki/Special:MyLanguage/MapleStory_Classic_World_Route_Planner"],
  "notes": null
}
