{
  "id": "classic-niameowdb-damage-simulator",
  "name": "NiaMeowDB Classic Damage Simulator",
  "website": "NiaMeowDB",
  "page": "Damage Simulator",
  "url": "https://meowdb.com/msclassic/dmg-simulator",
  "series": "classic",
  "regions": ["global"],
  "languages": ["en"],
  "category": "simulator",
  "subcategory": "combat-damage",
  "description": "Calculates and compares Classic World damage and DPS for a selected class, build, skill, and target.",
  "official": false,
  "opensource": false,
  "github_url": null,
  "api_url": null,
  "mobile_support": "responsive",
  "login_required": false,
  "status": "active",
  "last_checked": "2026-07-25",
  "tags": ["combat", "damage", "dps", "niameowdb"],
  "source_urls": ["https://meowdb.com/msclassic/dmg-simulator"],
  "notes": "This is a community model; use current in-game testing when an exact result matters."
}
