{
  "id": "idle-wiki-weapon-summon-calculator",
  "name": "Idle RPG Weapon Summoning Chance Calculator",
  "website": "MapleStory Idle RPG Wiki",
  "page": "Calculator: Weapon Summoning Chance",
  "url": "https://idle.maplestorywiki.net/w/Calculator%3AWeapon_Summoning_Chance",
  "series": "idle",
  "regions": ["global"],
  "languages": ["en"],
  "category": "calculator",
  "subcategory": "summoning-chance",
  "description": "Calculates weapon-tier acquisition probability by summon level and rolls, plus ticket counts for target confidence levels.",
  "official": false,
  "opensource": false,
  "github_url": null,
  "api_url": null,
  "mobile_support": "responsive",
  "login_required": false,
  "status": "active",
  "last_checked": "2026-07-25",
  "tags": ["probability", "summoning", "tickets", "weapons"],
  "source_urls": ["https://idle.maplestorywiki.net/w/Calculator%3AWeapon_Summoning_Chance"],
  "notes": null
}
