{
  "id": "worlds-ai-coding-plugins",
  "name": "MSW AI Coding Plugins",
  "website": "GitHub",
  "page": "msw-ai-coding-plugins-official",
  "url": "https://github.com/MSW-Git/msw-ai-coding-plugins-official",
  "series": "worlds",
  "regions": ["global"],
  "languages": ["en"],
  "category": "developer-tool",
  "subcategory": "ai-coding",
  "description": "Public AI-assisted MapleStory Worlds authoring guidance for .mlua scripting, entities, models, UI, avatars, packages, combat, validation, and debugging.",
  "official": false,
  "opensource": false,
  "github_url": "https://github.com/MSW-Git/msw-ai-coding-plugins-official",
  "api_url": null,
  "mobile_support": "responsive",
  "login_required": false,
  "status": "active",
  "last_checked": "2026-07-25",
  "tags": ["ai-coding", "creator", "developer-tool", "github", "mlua"],
  "source_urls": ["https://github.com/MSW-Git/msw-ai-coding-plugins-official"],
  "notes": "The repository calls itself the public release mirror for the MSW maker base skill set, but no software license was visible and the organization ownership was not independently verified as Nexon-operated."
}
