{
  "id": "n-maplestory-n-subreddit",
  "name": "r/MaplestoryN",
  "website": "Reddit",
  "page": "MaplestoryN Community",
  "url": "https://www.reddit.com/r/MaplestoryN",
  "series": "n",
  "regions": ["multi-region"],
  "languages": ["en"],
  "category": "reddit",
  "subcategory": "player-community",
  "description": "Player-run MapleStory N community for current discussions, questions, update reactions, and shared discoveries.",
  "official": false,
  "opensource": false,
  "github_url": null,
  "api_url": null,
  "mobile_support": "responsive",
  "login_required": false,
  "status": "active",
  "last_checked": "2026-07-25",
  "tags": ["community", "discussion", "reddit"],
  "source_urls": ["https://www.reddit.com/r/MaplestoryN"],
  "notes": "Community posts are user-generated and should be verified against primary evidence before being treated as factual."
}
