{
  "id": "classic-world-subreddit",
  "name": "r/MSClassicWorld",
  "website": "Reddit",
  "page": "MapleStory Classic World Community",
  "url": "https://www.reddit.com/r/MSClassicWorld",
  "series": "classic",
  "regions": ["global"],
  "languages": ["en"],
  "category": "reddit",
  "subcategory": "player-community",
  "description": "Player-run Classic World community for test findings, questions, tools, launch discussion, and update reactions.",
  "official": false,
  "opensource": false,
  "github_url": null,
  "api_url": null,
  "mobile_support": "responsive",
  "login_required": false,
  "status": "active",
  "last_checked": "2026-07-25",
  "tags": ["community", "discussion", "reddit"],
  "source_urls": ["https://www.reddit.com/r/MSClassicWorld"],
  "notes": "Community posts are user-generated and should be verified against primary evidence before being treated as factual."
}
