{
  "id": "idle-mirpg-dps-projections",
  "name": "MIRPG DPS Projections",
  "website": "MIRPG Optimizer",
  "page": "DPS Projections",
  "url": "https://mirpg-optimizer.netlify.app/predictions",
  "series": "idle",
  "regions": ["global"],
  "languages": ["en", "zh-hant"],
  "category": "optimizer",
  "subcategory": "stat-weights",
  "description": "Analyzes Idle RPG stat weights and compares stat equivalencies for damage-planning decisions.",
  "official": false,
  "opensource": false,
  "github_url": null,
  "api_url": null,
  "mobile_support": "responsive",
  "login_required": false,
  "status": "active",
  "last_checked": "2026-07-25",
  "tags": ["damage", "dps", "mirpg", "stat-equivalence", "stat-weights"],
  "source_urls": ["https://mirpg-optimizer.netlify.app/predictions"],
  "notes": "This is a community calculation model and not an official Nexon formula."
}
